{
  "links": {
    "self": "https://ora.ox.ac.uk/objects.json?per_page=3&q=climate",
    "next": "https://ora.ox.ac.uk/objects.json?page=2&per_page=3&q=climate",
    "last": "https://ora.ox.ac.uk/objects.json?page=2192&per_page=3&q=climate"
  },
  "meta": {
    "pages": {
      "current_page": 1,
      "next_page": 2,
      "prev_page": null,
      "total_pages": 2192,
      "limit_value": 3,
      "offset_value": 0,
      "total_count": 6574,
      "first_page?": true,
      "last_page?": false
    }
  },
  "data": [
    {
      "id": "uuid:ffe1394e-cfea-4e55-a561-2b707325fd1b",
      "type": null,
      "attributes": {
        "title": "Climate Change Scenarios for the United Kingdom - Technical Report No 1",
        "alternative_title": {
          "id": "https://ora.ox.ac.uk/objects/uuid:ffe1394e-cfea-4e55-a561-2b707325fd1b#alternative_title",
          "type": "document_value",
          "attributes": {
            "value": [
              "Summary Report "
            ],
            "label": "Alternative title"
          }
        },
        "index_authors": {
          "id": "https://ora.ox.ac.uk/objects/uuid:ffe1394e-cfea-4e55-a561-2b707325fd1b#index_authors",
          "type": "document_value",
          "attributes": {
            "value": [
              "Hulme, M, Jenkins, G"
            ],
            "label": "Author"
          }
        },
        "citation_publication_date": {
          "id": "https://ora.ox.ac.uk/objects/uuid:ffe1394e-cfea-4e55-a561-2b707325fd1b#citation_publication_date",
          "type": "document_value",
          "attributes": {
            "value": [
              "1998-01-01"
            ],
            "label": "Publication date"
          }
        }
      },
      "links": {
        "self": "https://ora.ox.ac.uk/objects/uuid:ffe1394e-cfea-4e55-a561-2b707325fd1b"
      }
    },
    {
      "id": "uuid:3f623d24-346f-4c48-a88e-301f1c951b55",
      "type": null,
      "attributes": {
        "title": "Geographies of climate change belief",
        "index_authors": {
          "id": "https://ora.ox.ac.uk/objects/uuid:3f623d24-346f-4c48-a88e-301f1c951b55#index_authors",
          "type": "document_value",
          "attributes": {
            "value": [
              "Hopkins, DM, Markowitz, EM"
            ],
            "label": "Author"
          }
        },
        "citation_publication_date": {
          "id": "https://ora.ox.ac.uk/objects/uuid:3f623d24-346f-4c48-a88e-301f1c951b55#citation_publication_date",
          "type": "document_value",
          "attributes": {
            "value": [
              "2018-04-05"
            ],
            "label": "Publication date"
          }
        }
      },
      "links": {
        "self": "https://ora.ox.ac.uk/objects/uuid:3f623d24-346f-4c48-a88e-301f1c951b55"
      }
    },
    {
      "id": "uuid:56113cc2-0ce2-4d65-8a46-b70da6c8dd11",
      "type": null,
      "attributes": {
        "title": "Methods of attributing human mobility to climate change: evidence from East Africa",
        "index_authors": {
          "id": "https://ora.ox.ac.uk/objects/uuid:56113cc2-0ce2-4d65-8a46-b70da6c8dd11#index_authors",
          "type": "document_value",
          "attributes": {
            "value": [
              "Thalheimer, L"
            ],
            "label": "Author"
          }
        },
        "rights_copyright_date": {
          "id": "https://ora.ox.ac.uk/objects/uuid:56113cc2-0ce2-4d65-8a46-b70da6c8dd11#rights_copyright_date",
          "type": "document_value",
          "attributes": {
            "value": [
              2021
            ],
            "label": "Copyright date"
          }
        }
      },
      "links": {
        "self": "https://ora.ox.ac.uk/objects/uuid:56113cc2-0ce2-4d65-8a46-b70da6c8dd11"
      }
    }
  ],
  "included": [
    {
      "type": "facet",
      "id": "f_type_of_work",
      "attributes": {
        "label": "Item Type",
        "items": [
          {
            "attributes": {
              "label": "Journal article",
              "value": "Journal article",
              "hits": 5143
            },
            "links": {
              "self": "https://ora.ox.ac.uk/objects.json?f%5Bf_type_of_work%5D%5B%5D=Journal+article&per_page=3&q=climate"
            }
          },
          {
            "attributes": {
              "label": "Thesis",
              "value": "Thesis",
              "hits": 701
            },
            "links": {
              "self": "https://ora.ox.ac.uk/objects.json?f%5Bf_type_of_work%5D%5B%5D=Thesis&per_page=3&q=climate"
            }
          },
          {
            "attributes": {
              "label": "Working paper",
              "value": "Working paper",
              "hits": 212
            },
            "links": {
              "self": "https://ora.ox.ac.uk/objects.json?f%5Bf_type_of_work%5D%5B%5D=Working+paper&per_page=3&q=climate"
            }
          }
        ]
      },
      "links": {
        "self": "https://ora.ox.ac.uk/objects/facet/f_type_of_work.json?per_page=3&q=climate"
      }
    },
    {
      "type": "facet",
      "id": "computed__contains_full_text",
      "attributes": {
        "label": "File Availability",
        "items": [
          {
            "attributes": {
              "label": "true",
              "value": "true",
              "hits": 5024
            },
            "links": {
              "self": "https://ora.ox.ac.uk/objects.json?f%5Bcomputed__contains_full_text%5D%5B%5D=true&per_page=3&q=climate"
            }
          },
          {
            "attributes": {
              "label": "false",
              "value": "false",
              "hits": 1550
            },
            "links": {
              "self": "https://ora.ox.ac.uk/objects.json?f%5Bcomputed__contains_full_text%5D%5B%5D=false&per_page=3&q=climate"
            }
          }
        ]
      },
      "links": {
        "self": "https://ora.ox.ac.uk/objects/facet/computed__contains_full_text.json?per_page=3&q=climate"
      }
    },
    {
      "type": "facet",
      "id": "f_contributors__division",
      "attributes": {
        "label": "Division",
        "items": [
          {
            "attributes": {
              "label": "MPLS",
              "value": "MPLS",
              "hits": 2491
            },
            "links": {
              "self": "https://ora.ox.ac.uk/objects.json?f%5Bf_contributors__division%5D%5B%5D=MPLS&per_page=3&q=climate"
            }
          },
          {
            "attributes": {
              "label": "SSD",
              "value": "SSD",
              "hits": 2165
            },
            "links": {
              "self": "https://ora.ox.ac.uk/objects.json?f%5Bf_contributors__division%5D%5B%5D=SSD&per_page=3&q=climate"
            }
          },
          {
            "attributes": {
              "label": "MSD",
              "value": "MSD",
              "hits": 351
            },
            "links": {
              "self": "https://ora.ox.ac.uk/objects.json?f%5Bf_contributors__division%5D%5B%5D=MSD&per_page=3&q=climate"
            }
          }
        ]
      },
      "links": {
        "self": "https://ora.ox.ac.uk/objects/facet/f_contributors__division.json?per_page=3&q=climate"
      }
    },
    {
      "type": "facet",
      "id": "f_contributors__department",
      "attributes": {
        "label": "Department",
        "items": [
          {
            "attributes": {
              "label": "SOGE",
              "value": "SOGE",
              "hits": 1537
            },
            "links": {
              "self": "https://ora.ox.ac.uk/objects.json?f%5Bf_contributors__department%5D%5B%5D=SOGE&per_page=3&q=climate"
            }
          },
          {
            "attributes": {
              "label": "Physics",
              "value": "Physics",
              "hits": 980
            },
            "links": {
              "self": "https://ora.ox.ac.uk/objects.json?f%5Bf_contributors__department%5D%5B%5D=Physics&per_page=3&q=climate"
            }
          },
          {
            "attributes": {
              "label": "Earth Sciences",
              "value": "Earth Sciences",
              "hits": 497
            },
            "links": {
              "self": "https://ora.ox.ac.uk/objects.json?f%5Bf_contributors__department%5D%5B%5D=Earth+Sciences&per_page=3&q=climate"
            }
          }
        ]
      },
      "links": {
        "self": "https://ora.ox.ac.uk/objects/facet/f_contributors__department.json?per_page=3&q=climate"
      }
    },
    {
      "type": "facet",
      "id": "f_contributors__college",
      "attributes": {
        "label": "College",
        "items": [
          {
            "attributes": {
              "label": "Oriel College",
              "value": "Oriel College",
              "hits": 150
            },
            "links": {
              "self": "https://ora.ox.ac.uk/objects.json?f%5Bf_contributors__college%5D%5B%5D=Oriel+College&per_page=3&q=climate"
            }
          },
          {
            "attributes": {
              "label": "St Cross College",
              "value": "St Cross College",
              "hits": 119
            },
            "links": {
              "self": "https://ora.ox.ac.uk/objects.json?f%5Bf_contributors__college%5D%5B%5D=St+Cross+College&per_page=3&q=climate"
            }
          },
          {
            "attributes": {
              "label": "Linacre College",
              "value": "Linacre College",
              "hits": 114
            },
            "links": {
              "self": "https://ora.ox.ac.uk/objects.json?f%5Bf_contributors__college%5D%5B%5D=Linacre+College&per_page=3&q=climate"
            }
          }
        ]
      },
      "links": {
        "self": "https://ora.ox.ac.uk/objects/facet/f_contributors__college.json?per_page=3&q=climate"
      }
    },
    {
      "type": "facet",
      "id": "f_contributors__research_group",
      "attributes": {